1,背骨のある動物を何といいますか。,せきつい動物,無セキツイ動物,セキツイ動物,背骨動物,せきずい動物
2,背骨のない動物を何といいますか。,無せきつい動物,せきずい動物,セキツイ動物,無セキツイ動物,背骨動物
3,親が卵をうみ、卵から子がかえるうまれ方を何といいますか。,卵生,育生,卵生,胎生,母生
4,子が、母親の体内である程度育ってからうまれるうまれ方を何といいますか。,胎生,卵生,母生,育生,胎生
5,環境の温度が変化しても、体温がほとんど変化しない動物を何といいますか。,恒温動物,恒温動物,一定動物,高温動物,定温動物
6,環境の温度の変化にともなって体温が変化する動物を何といいますか。,変温動物,変化動物,温度動物,低温動物,変温動物
7,セキツイ動物のなかまで、幼生はえらで呼吸し、成体は肺と皮膚で呼吸するなかまを何といいますか。,両生類,哺乳類,は虫類,魚類,両生類
8,セキツイ動物のなかまで、変温動物で陸上に殻のある卵をうむなかまを何といいますか。,は虫類,鳥類,は虫類,両生類,哺乳類
9,セキツイ動物のなかまで、からだが羽毛におおわれているなかまを何といいますか。,鳥類,は虫類,鳥類,両生類,哺乳類
